date,name,hometown,state,gender,major,insta,post
2021-05-04T23:53:28.000Z,Khushi,Johns Creek,,BLANK,business admi,,"Hii my name is Khushi and I'm from Johns Creek, GA! I plan on majoring in business admin and potentially computing and I'll be starting this summer with ignite. I love watching movies (current obsession is ones with crime investigations), listening to music, trying as many different boba recipes as possible, and trying to recreate said recipes at home haha. I'm looking to meet new people and find a roomie so pls reach out!!! my ig is @khushiafre and snap is khush.iii 🙆🏻‍♀️5w"
2021-05-04T20:38:54.000Z,Freya,Northern Jersey,,BLANK,,,"Hey guys!! My name's Freya, I'm from Northern Jersey, and I just committed to GATech for Comp Sci. I enjoy reading and watching tv/anime/movies. Recently been obsessed with Interstellar, Les Mis, AOT, and La Casa de Papel! My music taste spans from Taylor Swift to the Dire Straits, but right now I'm listening to a lot of Peach Pit and the Strokes. I also love!! Joji's Slow Dancing in the Dark! and can't stop playing it on the piano.Aside from that I like to hike and create art even though I'm not the expert at those things. I always look forward to meeting new people, and I'm also looking for roomies for a quad! If you want to talk or found the bite marks in my ice cream bar controversial, my socials are freya_nair, so reach out on snap or insta!! :)5w"
2021-05-04T20:36:11.000Z,kareena,"suwanee, ga.",GA,BLANK,business admi,kareenakumar035w,"hi y'all my name is kareena and i'm from suwanee, ga. i'm committed for tech in the fall, and i'll be majoring in business admin. i love going to concerts, finding new coffee shops to study at, going on outdoor day trips, and traveling (i want to go to all 50 states by the time i'm 50!!). i'm very much a chill and easygoing person, and i cant wait to attend football/basketball games and explore atl. a fun fact about me is that i collect postcards!!i plan on studying abroad and possibly rushing. i'm looking for a roommate and friends so dm/snap me. snap: kareenakumar035w"
2021-05-04T19:40:19.000Z,Rishi Bengani,"Houston, Texas",,BLANK,computer science,rishibengani,"Hey everyone! My name is Rishi Bengani and I am from Houston, Texas. I am majoring in computer science. I am very excited to explore and try new things from activities to food! I love playing games, hanging with friends, the Houston Rockets, James Harden, working out, and watching almost any movie or tv show. I am also looking for a roommate so reach out if you are interested or even if you are not. I would love to meet y'all :)Insta: rishibenganiSnap: lilben20025w"
2021-05-04T19:20:55.000Z,benjamin solomon,solomon,,B,electrical engineering,benjamin_solomon_,"hey, everyone! my name is benjamin solomon (i go by ben), and I'll be starting this fall. i'm an electrical engineering major, but i'm thinking about double majoring with business administration. my favorite sport is basketball, and my favorite team is the lakers. i love anime, superheroes, and self-learning. i can't wait to make new friends, and i'm currently looking for a roommate. please feel free to dm me!ig: @benjamin_solomon_snap: benysolomon5w"
2021-05-04T19:20:52.000Z,Mahta,Northern Virginia,,BLANK,biomedical engineering,mahta.tv5w,"Hi guys!! My name is Mahta and I'm from Northern Virginia! I recently committed to Georgia Tech and will be majoring in biomedical engineering. I enjoy doing anything adventurous and am always down to try something new. I like hiking, finding cool places to eat, watching Nexflix (some of my fav tv shows are Psych, Gossip Girl, You, PLL, and Criminal Minds), and going to cute coffee shops or boba places. I also work at Starbucks so hmu if you want some cool drink suggestions 😉. I love meeting new people and I'm excited to make new friends!! I'm also looking for a roommate so feel free to reach out :) Insta: mahta.tv5w"
2021-05-04T12:44:53.000Z,Anu Lal,"Suwanee, GA.",GA,BLANK,biomedical engineering,anu.lal_,"Hey guys! My name is Anu Lal and I am from Suwanee, GA. I am committed to Tech as a biomedical engineering major. I love reading (my to be read list is crazy long) and some of my favorite books are Jane Eyre and the Secret History. I love watching movies as well and absolutely love Bridget Jones's Diary and the Kingsman series! I also enjoy listening to music and some of my favorite artists are Bon Iver, St. Vincent, the Lumineers, and Billie Marten! I also love sitcoms especially new girl. I am so excited to explore Atlanta and love hiking so please hmu if you're down to do that! I'd love to make new friends and am looking for a roommate so please hmu!Insta: anu.lal_Snap: crazy_fangirl10 (I know I'm embarrassed too)5w"
2021-05-04T03:09:09.000Z,prashanth,duluth ga,GA,BLANK,biology,prashanthratha5w,"hi! i'm prashanth and i'm from duluth ga! i'm committed to tech as a biology major on a pre med track. i love eating taco bell or any food at all, watching spongebob, hanging out with people, listening to music, and traveling. i'd love to make new friends and am also looking for a roomate in the explore llc so feel free to dm me. cant wait to see you guys on campus this fall :))insta: @prashanthratha5w"
2021-05-04T01:46:39.000Z,Nawid,Bangladesh,,BLANK,will defo,,"Hey, my name is Nawid. I'm originally from Bangladesh but I grew up most of my life in Qatar. I'm committed to gt and will defo major in CS. I'm a huge soccer fan, space enthusiast, and I love game development!! You'll probably catch me making tons of video games or designing cool Mars bases.I'm looking for a roommate so please reach out. Dw I'm a nerdy kid but I'm defo down for a night out!5w"
2021-05-04T00:58:41.000Z,tanya,overland park,,BLANK,committed to,tanya.pattani,"hey everyone! my name is tanya and i'm from overland park, ks. i got accepted ea and just recently committed to major in CS! i love debate and forensics and am an avid iced coffee lover :) my favorite shows include new girl, gilmore girls, the office, and grey's anatomy! i love sketching, painting, and playing just dance on wii in my free time and am always down for long walks with friends, so i definitely look forward to some late night adventures at gt! oh also, i'm a capricorn, so i definitely love organization but i also love long talks!please feel free to hmu, i'm definitely looking for a roommate!feel free to add me on my socials!insta: @tanya.pattani sc: tanyazolo22 (no idk what zolo means, yes, i was in middle school when i created the username)5w"
2021-05-04T00:21:00.000Z,a computer,mind,,BLANK,computer science,you,"They say the devil went down to Georgia, but maybe they meant Devin.╰(*´︶`*)╯I'm a computer science major. I like making games, D&D, painting miniatures, driving with my windows down to pop rock/punk, hanging out with my friends (read: you) with no plan in mind. Send me pictures of pretty skies and philosophical/theological questions pls!snap: heckingtaken5w"
2021-05-03T23:30:57.000Z,Julian,"Washington, D",,BLANK,industrial desig,,"Hey everyone, my name is Julian. I'm from Washington, D.C. and I'm majoring in industrial design. I love cooking, listening to music (some of my favorite bands right now are Dr Dog, The Strokes and LCD Soundsystem), going for long drives, hiking, exploring, and I also have a small business making kitchen knives. I'm looking for a roommate as well as to meet other people going to Tech so feel free to reach out!5w"
2021-05-03T22:43:36.000Z,Leire,Spain,,BLANK,biomedical engineering,leire_ripodasinstagram:,"hi! my name is Leire, I am from Spain. I am 100% committed to GaTech. I am majoring in biomedical engineering and I would love to rush in the fallI am a very active person, my passions are handcrafting, cooking, volunteering and traveling, and I love hanging out with my friends, doing road trips or watching some Netflix :) Pleas reach out, I would love to meet new friends and I am looking for a roommate ! snapchat: leire_ripodasinstagram: @leireripodasl5w"
2021-05-03T21:32:39.000Z,Jatin,"Mumbai, India",,BLANK,mechanical engineering,,"Hey! My name is Jatin and I'm from Mumbai, India and used to Saudi Arabia when I was younger. Im committed and will be majoring in mechanical engineering.  I'm also looking forward to do Co-op. I'm a big foodie (I can't wait to try fried chicken at the busy bee cafe!). I LOVE Gossip Girl and I'm into music, some of my favourite artists are J.Cole, Mura Masa, Notorious B.I.G, Mac DeMarco, and Arctic Monkeys. I love exploring cities and finding out about their history. Im excited to explore Atlanta and meet new people! Also I'm looking for a roommate, my Instagram is @yashroyjatin5w"
2021-05-03T21:32:35.000Z,Steven,"Suwanee, Georgia",GA,B,,,"Hey everyone! My name is Steven and I'm from Suwanee, Georgia. I just committed to tech and I plan on doubling in comp sci and finance! I love going on runs, listening to music (Kid Cudi, Weeknd, and Khalid are favorites), hanging out with friends, and chilling with my dog. Feel free to reach out to me through DMs and I can't wait to meet you guys!5w"
2021-05-03T15:05:56.000Z,Matthew,East Cobb,,B,,matthewaroninSnapchat:,"Hi all! My name is Matthew, and I'm from East Cobb/Marietta/Georgia (whichever you're most familiar with lol). I'm so excited to be committed to studying Math at Georgia Tech! Besides math, I really love graphic design and musical theatre (my favorite shows are Next to Normal and Great Comet). I also have a lot of fun performing magic and talking about anything Disney/Marvel/Star Wars!I've committed to joining the Explore LLC and I'm looking for a roommate. Even if you aren't doing Explore, free free to reach out — I'm looking forward to getting to know you all!Instagram: @matthewaroninSnapchat: matthew.aro#GT25 #GoJackets #IGotIn5w"
2021-05-03T11:54:50.000Z,Adityaa Magesh,Central Jersey,,BLANK,computer science,,"Hey guys! My name is Adityaa Magesh Kumar and I'm from Central Jersey. I'm going to commit soon and I'm majoring in computer science. I love to work out, run, play/watch sports like tennis, explore new places, read (lmk if u got any good recs), attempt cooking (I make clean scrambled eggs), try new foods, and chill with friends. A fun fact about me is that I worked as a ballperson at the 2018 US Open. I'm excited to meet some new friends, and possibly a roommate. Feel free to reach out @adityaamk on ig & snap.5w"
2021-05-03T11:52:51.000Z,bri,"edison, nj",NJ,BLANK,My,im,"haiiii im bri and im from edison, nj! Im 100% committed to gt and im so excited to meet yall! My major is aerospace engineering and i might minor in spanish. A little about me: im a bubble tea connoisseur and foodie. I love watching movies (esp ranking bad romcoms on netflix lol), and I could rave abt the mcu for days. Some of my fav shows are the middle, friends, and criminal minds. I like listening to The 1975, taylor swift, daniel caesar, 5sos, obc soundracks, and a bunch of others. I like taking walks, shopping, swimming, and sometimes spending a quiet night in. If you need a friend to explore the city w, go to the gym, grab food, or go to games, hmu!! Im always down to make new friends!5w"
2021-05-03T11:41:30.000Z,Katie Hatcher,"Macon, Georgia",GA,BLANK,public policy,katiehatcherrr,"Hi everyone! My name is Katie Hatcher and I'm from Macon, Georgia. I will be starting at tech this summer and plan on majoring in communications, with a potential double major in public policy. I was a cheerleader, dancer, and swimmer in high school. I love watching movies, eating teriyaki, and chilling with my dog (her name is Sydney). I'm also a huge reader—my favorite books are A Tale of Two Cities and the Harry Potter series (it's my hyperfixation lol). I'm also a huge traveler and would like to study abroad at some point during my four years. I plan on rushing in the fall and would love to have someone to hang out/workout out with, so please reach out! Ig: @katiehatcherrrSnap: katie_hatcher35w"
2021-05-03T11:40:12.000Z,claudia decredico,"milton, ga",GA,BLANK,chemistry,,"hi everyone!! my name is claudia decredico and i'm from milton, ga! i'm 100% committed and will be starting in the fall as a chemistry major (pre med) and i also plan on rushing! i've been a competitive irish dancer for 14 years and plan on continuing dance while at tech! i also love working out, spending time outside, and coffee :) im looking for a roommate so please reach out if you think we are similar! go jackets 😁🐝insta @claudiadecredico5w"
2021-05-02T23:08:03.000Z,Kushagra but,New Delhi,,BLANK,,_kushagra13_,"Hi everyone! My name is Kushagra but most people call me Kush. I'm originally from New Delhi, India but I've been living near Philly for the last 2-3 years. I committed to Tech last week and will be studying Chemical and Biomolecular Engineering. I love to play and watch all sports (basketball, football, cricket, soccer, etc). I spend my free time lifting, hanging out with my friends, and watching Netflix. My favorite shows are Breaking Bad, The Office, Friends and my favorite movies are Good Will Hunting, Superbad, 3 Idiots, and anything Marvel. I'm always down to try new restaurants and I'll be spending a lot of time exploring the city. My favorite artists are The Weeknd, Eminem, Rex OC, Kanye, Lauv, and Arijit Singh (music suggestions are welcome). I'm looking forward to meeting y'all and finding a roommate. Feel free to reach out! Insta: @_kushagra13_Snap: @kush_agra135w"
2021-05-02T22:44:51.000Z,Ryan,camping,,B,,,"Hey guys! I'm Ryan, and I'll be studying mechanical engineering at tech in the fall. I go to Grady (soon to be Midtown) high school in Atlanta, and in school I've played water polo and swam as well as working on the robotics team. Outside of school I love to workout and do anything outdoors(some of these photos are from camping and a recent road trip to Santa Fe) I can't wait to meet y'all so feel free to follow me on ig!5w"
2021-05-02T20:40:45.000Z,adaora njoku,nigeria,,BLANK,cs,adaora.njoku5w,"hey! my name is adaora njoku and i'm from nigeria. I go between lagos and boarding school in pennsylvania . i'm majoring in cs and i'm gonna start with iGniTe in the summer on the sustainable communities track. I love movies, traveling, and Mitski. i can't wait to meet everyone! ig and snap: adaora.njoku5w"
2021-05-02T16:29:14.000Z,Miranda,"Destin, FL",FL,BLANK,ll be,,"Hi!! I'm Miranda & I'm from Destin, FL! I'm committed to GT (starting through iGniTe virtually this summer) and as of right now I'll be majoring in mathematics, but that could definitely change 🥴 I'm also thinking about joining some kind of concert band (I play oboe and alto sax). Some of my (very random) favorite things are coffee (+ Gilmore Girls HA), photography (I'm definitely the photographer friend), 10 Things I Hate About You (80s movies >>>), MUSIC (Saint Motel, Khalid, Harry Styles, Hozier, The Strokes), roadtrips, and apparently I like using parentheses?? As of right now I don't know anyone else going to Tech so I'm still looking for a roommate and adventure buddies!! :) P.S I love dad jokes so absolutely send me your favs @mirandagillaspy5w"
2021-05-02T15:19:43.000Z,Kieran,"Tyrone, Georgia",GA,BLANK,Computer Science,kieran.rm,"Sup guys! My name's Kieran and I'm from Tyrone, Georgia. I'll be going to Tech in the fall and majoring in Computer Science.Outside of school I'm super into making games with the Unity engine, and I'm also an avid rock climber. I love going outside and exploring new places, so hmu if you're tryna climb sometime!IG: @kieran.rmSnap: krmman5w"
2021-05-01T22:14:09.000Z,Parth Arora,India,,BLANK,Computer Science,,"Hey Guys,I am Parth Arora, from India (Punjab), and just committed to GeorgiaTech. I'll be majoring in Computer Science and plan to minor in business and computing this fall. I play badminton, like reading and writing, and am already a published author having written 2 books at age 13 & 14. I love technology and finding solutions to new problems and am currently working on my startup Kidea.in I love to talk to and meet new people and am hoping to know you guys, so of course, please feel free to reach out ( @partharora1105 ) because if you don't, I know I will 😅Looking forward to beginning a new chapter of our lives with you guys!Go Jackets!!#gt25 #igotin5w"
2021-05-01T19:11:34.000Z,Beri,near Washington,,BLANK,mechanical engineering,,"what's up everyone, my name is Beri, I'm from near Washington, DC, and going to commit to GT soon. I'm probably going to major in mechanical engineering but I think I'll want to double major or minor in something else (not sure yet). I'm not planning on rushing but idk might change my mind. in my free time I make beats, skate, play basketball and volleyball, and cook. feel free to dm me, I might be looking for a roommate too (I have no idea how the whole roommate situation is going to work tbh) 👍 and congrats to everyone else who got in!5w"
2021-05-01T16:29:05.000Z,dhaval,the suburbs of philly,,BLANK,tech,dhavalsharma_,"hey everyone! my name's dhaval and i'm from the suburbs of philly. im committed to tech and majoring in cs. im super excited to meet everyone soon!i love drawing, animating, working out, concerts, thrifting, cooking, fun socks, and frogs. my favorite band is glass animals and my favorite shows are new girl, breaking bad, b99, and parks and rec. i also watch some anime like AoT and FMA. i plan on joining greek life at tech and feel free to reach out to me! i'm looking for a roommate and just to meet people in general.insta: @dhavalsharma_snap: dhavals17245w"
2021-04-30T23:03:32.000Z,Jayden or,,,BLANK,Eco,,"I'm Jayden or Jay, I plan on being a Econ major. I listen to a lot of music and into most sports. Dm if you have a similar major or for any really. Excited For the next four years!5w"
2021-04-30T20:41:47.000Z,kirti,,,BLANK,math,kirti.bharadwaj,"hi guys!! my names kirti and i'm a 100% committed to tech as a math major🥳 my favorite type people are liberals, sags, geminis, libras, leos, and aqauriuses ofc🥰 i love to travel, eat ramen (instant and jinya), go on late night adventures, read/analyze people's charts, meet new people and to sleep😸 im super excited to go to all the bollywood dance comps (and hopefully be on a team too :) also i love animals especially momo and sparky ft on last slide:))i plan to live on campus and am looking for a roommate, so please reach out!snap: kirti.bharadwaj insta/costar: kirti_bharadwaj5w"
2021-04-30T18:14:57.000Z,Josh,"Buffalo, NY",NY,B,business,jblumes,"Hey I'm Josh from Buffalo, NY! I just committed to GTech - majoring in business and am looking for a roommate for the fall. A little about me is I'm a huge music guy... favorites are Travis Scott, Mac Miller, JID, and Uzi but I also make my own. You can find me on apple music, spotify, etc. under “Jblumes.” I love all sports and i play baseball, tennis, and volleyball. I'm also looking to play club ultimate frisbee. In free time, I'm either going out with the boys or just having a chill night skating or taking dope pictures. Lmk if interested!! IG: jblumes Snap: josh_blumenson#gt25 #igotin5w"
2021-04-30T17:36:22.000Z,Ayush Baweja,New Jersey,,BLANK,CS,ayush.bawejasnapchat:,"Hey! I'm Ayush Baweja and i'm from New Jersey, but I've been living in India for the past few years. I'm a CS major and I'm fully committed to Tech. I like listening to music (current rotation includes Brockhampton, Tyler, clipping., slowthai), trying new foods (esp coffee), casual debates and sending voice notes of myself laughing at memes.I would love to make some friends so feel free to dm just to talk (or if you have a startup idea 👀). Also looking for someone to teach me how to play smash👾instagram: @ayush.bawejasnapchat: ayushbaweja5w"
2021-04-30T13:59:41.000Z,Aman,"Roswell, GA",GA,BLANK,mechanical engineering,,"hey everyone my name is Aman, I'm from Roswell, GA, and i'll be majoring in mechanical engineering this fall at GT. I like to balance school with being social and if anyone is interested in being a roommate please feel free to message me.5w"
2021-04-30T11:15:38.000Z,Shivangi Singh,"alpharetta, georgia",GA,BLANK,music technology,shivangi182insta:,"hi guys! my name is Shivangi Singh and im from alpharetta, georgia. im planning on attending gt for fall 2022 as i got conditional acceptance through the arts and sciences pathway. as of right now, i will be majoring in music technology. i love playing guitar, singing, playing tennis, and learning how to play instruments in general. i cant wait to meet new people at gt! feel free to reach out:)snap: shivangi182insta: @shivangi.__.singh5w"
2021-04-29T23:16:31.000Z,steve,long island,,B,,aot,"hi! im steve and im from long island, new york! im committed to tech for biomedical engineering. i'm into lifting, creating music, watching anime, and learning languages (learning my 4th rn).i play the drum set, piano, and guitar and i plan on joining tech's jazz ensemble.  i LOVE doing anything outdoorsy including skateboarding, kayaking, fishing, hiking, and camping. i've been skydiving and spontaneity is my middle name! i like literally ALL genres of music (mainly pop, rock, soul and jazz) and my favourite artists are bruno mars, stevie wonder, and the jackson 5. in my free time, i play basketball, football, and badminton. my fav netflix shows are the 100, breaking bad, the office, TWD, and shameless. fav animes: aot, hxh, naruto, dbz, death note, demon slayer, tokyo ghoul. i play video games, such as: valorant, minecraft, gta 5, etc.im unsure if i will rush in the fall yet, but i am looking for a roommate and lifting buddy! add me on insta + snap: notstevegeorge5w"
2021-04-29T17:09:12.000Z,Ford Carter,"Atlanta, Georgia",GA,BLANK,plan o,,"Hey, I'm Ford Carter from Atlanta, Georgia. I'm committed to Georgia Tech and plan on majoring in business. I run XC and track but love to play/watch most sports. I'm looking for a roommate and new friends so feel free to reach out!6w"
2021-04-29T11:29:13.000Z,Noa Deseda,"Atlanta, Georgia",GA,BLANK,,noadeseda,"Hi guys! My name is Noa Deseda and I'm from Atlanta, Georgia. I am not 100% committed to GT, but it's my top choice right now. I love to go out with my friends, but I'm always down for a night in! I enjoy working out, coffee runs, traveling, food, and I am a very laid back & adventurous person. I also plan on rushing & I am applying to study in Metz, France this fall! I'm majoring in psychology, and I'm looking for a roommate and new friends so please don't hesitate to reach out 🥰🥰🥰 Instagram: @noadeseda Snapchat: @ndeseda6w"
2021-04-28T15:33:27.000Z,Halle ,Gwinnett County,,BLANK,biology,,"Hey, y'all! My name is Halle (pronounced like Halle Berry). I'm from Gwinnett County, GA. I have recently committed to Tech as a biology major with an interest in molecular biology and immunology. I consider myself a ""jack of all trades"" meaning that I enjoy practically everything. This includes outdoor activities (like soccer, hiking, and swimming), indoor activities (like watching movies, badminton, playing guitar, and thrifting), and fun experiences (like hanging with friends, jamming to music, and traveling). If you are looking for a friend or roommate on West who's willing to do anything at anytime, feel free to DM me @__.halle.lujah.__ . See y'all soon during the upcoming semester!6w"
2021-04-28T12:28:30.000Z,Daniel,"Columbus, Ohio",,B,computer science,,"How's everyone doing I'm Daniel and I'm from Columbus, Ohio. I was offered admission as a transfer student so I will be joining you guys next year. I will also be majoring in computer science. I enjoy playing games, listening to kpop, and getting fast food. I'm super excited for the upcoming years, especially for the weekend h mart runs. I'll see everyone next year6w"
2021-04-28T10:09:45.000Z,Kashvi,"Suwanee, Georgia",GA,BLANK,plan to,,"Hey y'all!! I'm Kashvi and I'm from Suwanee, Georgia. I'm committed to tech and I plan to major in physics w/ an astrophysics path! I love music — I play a few instruments (symphony orchestra!!) and sing! I'm also starting to get into production. I listen to literally every genre, but my most notable category is kpop (skz is my ult). I really vibe with indie bands too! I play some games on my switch — BOTW and Hades rn. I also love the outdoors, so I'd be down to be hiking buddies :) Hmu if y'all like having philosophical discussions — currently studying Carl Jung! I've also recently become fascinated by the concept of liminal space, both physical and psychological. I'm also looking for a roommate at prolly Glenn or Towers.I'd love to meet y'all, feel free to dm me whenever :))6w"
2021-04-27T20:07:20.000Z,Phoebe,"Concord, Massachusetts",,BLANK,industrial desig,phoebe.shudt,"Hi guys! I'm Phoebe and I'm from Concord, Massachusetts (~30 mins from Boston). I just committed and I plan on majoring in industrial design. I spend a lot of time playing volleyball, getting coffee, walking my dog, and going to Trader Joe's. I also love hiking, beach trips, and adding to my Spotify playlists (music suggestions welcome!) I'm thinking about rushing and I'm looking for a roommate so definitely reach out! I'm excited to meet everyone!insta: @phoebe.shudtsnap: phoebe9226w"
2021-04-27T11:47:16.000Z,Krishi,"Mumbai, India",,BLANK,erospace engineering,,"Hi everyone!! My name's Krishi and I'm from Mumbai, India. I'm committed to tech and planning to major in aerospace engineering (might switch to mechanical idk). I enjoy planning tennis, hanging out with friends, travelling, skiing, and anything fashion-related. I love binging tv shows (rn I'm watching modern family) and I also like cooking for my family. I can make some pretty neat Indian food!! I'm looking for a roommate so feel free to contact me :) My Instagram is @krishimanek6w"
