date,name,hometown,state,gender,major,insta,post
2021-04-13T17:01:14.000Z,Jonathan Kang,"Mooresville, North Carolina",,B,,Jonathannkangg,"Yo wassup guys I'm Jonathan Kang and I'm  a Korean-American from Mooresville, North Carolina. I am committed to tech and will be studying computer science!I play tennis and soccer, but I practically enjoy every sport out there. I'm a big people person as I love hanging out with friends and just getting to know new people. On my free time, I love playing games while vibing to music. Also a big foodie so who tryna go explore Atlanta? Looking for a roommate and people to talk to so hmu! Insta: Jonathannkangg Snap: Jonathankaang#gt25 #igotin8w"
2021-04-13T16:35:34.000Z,Shay Porter,Flowery Branch,,BLANK,psychology,,"Hey! I'm Shay Porter from Flowery Branch, GA. I'm committed to Tech and am a psychology major as of now but I am probably going to switch to public policy. I am looking forward to getting involved on campus, meeting new people, and enjoying life in the city! I am hoping to join a lot of campus clubs and maybe get an internship or study abroad. I'm looking for a roommate and can't wait to meet you guys in ATL in the fall so hmu!😁#gt25 #igotin8w"
2021-04-13T14:27:00.000Z,Nick Casertano,Maryland,,B,Aerospace Engineering,ncasertanothatguy00021,"Hello everyone! My name is Nick Casertano and I am from Maryland. I have not committed yet , but Tech is one of my top choices. I will be majoring in Aerospace Engineering and I may switch to Mechanical Engineering. I love watching and playing basketball( I am a big GSW fan even though they have been disappointing this year). I also ski, swim, play tennis,run cross country, and workout. I love watching movies and TV shows(especially movies or TV shows relating to Star Wars or Marvel). I plan to start in the summer with ignite. I cannot wait to meet everyone. Instagram: @ncasertanoSnap:thatguy00021#gt25 #igotin8w"
2021-04-13T12:16:31.000Z,from London,London,,BLANK,will be,,"Hi everyone! My name Henrietta, I am from London and so excited to begin this new chapter in Atlanta at Georgia Tech this fall! I will be majoring in neuroscience. I love singing, shopping, travelling and meeting new people so feel free to reach out! Looking for a potential roommate too :)my insta is @mshennesse and snapchat @mshennesse#gt25 #igotin8w"
2021-04-13T11:24:34.000Z,libby nesbitt,physics,,BLANK,physics,,"heyoo my name is libby nesbitt and i am 100% committed to go to gt!! i am most likely going to major in physics and minor in a language (idk which one yet haha). also, i am doing air force rotc and i wanna do a sorority!! i just got an instagram so you should give me a follow and add me on snap:)) snap// libbyy.nesbittinsta// libbyy.n#gt25 #igotin8w"
2021-04-13T04:01:56.000Z,Aleks,Peachtree City GA,GA,BLANK,Chemical Engineering,astec711Insta,"Hi everyone!My name is Aleks and I'm from Peachtree City GA, just south of Atlanta. I plan to double major in Chemical Engineering and Materials Science Engineering (Might be biting off more than I can chew.) I'm also planning to start this summer with iGniTe and fly to Metz as part of the First Year Fall Abroad program.I've been to 24 National Parks so I love to travel, bike, hike, and go on road trips. I also love to cook and try new foods! (Most of the time. Maybe.)Excited to meet everyone, especially everyone else in the First Year Fall Abroad program!Snap : astec711Insta : _aleks.7(Peep my pet squirrel Eustis)#gt25 #igotin8w"
2021-04-13T02:42:57.000Z,ria,"phoenix, arizona",,BLANK,comp sci,pizza_ria,"hii im ria! i'm from phoenix, arizona and I'm planning on majoring in comp sci and design. i haven't committed to gt yet but it's one of my top choices. i love to constantly make art and watching shows like Parks & Rec, Brooklyn 99 and Jane the Virgin. I'm excited to meet new people and try new restaurants around Atlanta and I do plan on rushing! Hmu if you wanna be friends or are looking for a roommate!Insta: @pizza_riaSnap: pizza_ria#gt25 #igotin8w"
2021-04-13T00:12:21.000Z,Rebecca,"Alpharetta, GA",GA,BLANK,,rebeccaaa.135,"Hi guys! I'm Rebecca from Alpharetta, GA and I plan on studying environmental engineering at Tech this fall. I love anything music related (fav artists change but right now Harry Styles, Ed Sheeran, Niall Horan, 1D), and I play four different instruments, mainly guitar and piano (violin too but only in an orchestra). My main hobby right now is running my own small business through Etsy making stickers! I take care of probably too many plants and spend most of my time reading, working on robotics, and playing with my dogs. I plan on using the CRC for swimming, but definitely not competitively, so if anyone wants a swimming buddy, hit me up! I'm a little bit of an introvert, but I really want to make new friends here at GT. I'm also looking for a roomie on West!Insta: rebeccaaa.135(shameless plug: designsbyrebeccakay on etsy)#gt25 #igotin8w"
2021-04-12T22:47:30.000Z,Suraya,virginia beach,,BLANK,,,"hi everyone! i'm Suraya (sir-eye-uh) & i'm from virginia beach, va. i committed to tech for aerospace engineering. i enjoy track & field, astronomy, fashion, shopping/thrifting, eating, and traveling. i'm open to meeting new friends. dm me with your favorite songs and let's start a conversation! :)#gt25 #igotin8w"
2021-04-12T22:45:27.000Z,Robby,"Covington, GA.",GA,BLANK,either business,,"Hey y'all! I'm Robby and I'm from Covington, GA. I am committed to Tech and plan on majoring in either business administration or industrial engineering. I enjoy hanging out with friends, playing sports, hiking, and traveling. I plan on rushing and joining a few intramural sports at GT.If you'd be interested in rooming together or just wanna hang feel free to reach out to me @robbymcgold#gt25 #igotin8w"
2021-04-12T21:42:53.000Z,Joshua,rnb from khai dreams,,BLANK,,joshua_chio,"Hey everyone! My name is Joshua, and I am practically a commit for electrical engineering. I grew up in Coppell, TX (near Dallas), but I was actually born in Atlanta. I was in band and orchestra during high school, but I also love listening to music. My music taste is all over the place from rnb from khai dreams, daniel caesar, kolohe kai to krnb from junny or some anime ost. I'm always open to any new music suggestions! I am always down to play any sports like basketball, volleyball, or badminton. I love watching all types of tv such as aot, it's always sunny, or hotel del luna. I also play video games like league or minecraft. Honestly I just enjoy doing or watching things with friends so hit me up with any activities you wanna do. Also I'm gonna need recs for where to eat in Atlanta. I can't wait to meet all of y'all.I am also looking for a possible roommate so feel free to message me if you'd be down.insta: @joshua_chiosc: honeynutchios#gt25 #igotin8w"
2021-04-12T21:34:31.000Z,Cas,electrical engineering,,BLANK,electrical engineering,,"Hi my name's Cas, and my life... is pretty great. I'm majoring in electrical engineering and I live mi vida loca by a set of rules1. Take time to sniff the flowers (💜V)2. Love hard. Cube harder3. PC > Console Looking for a roommate who will electrocute my heart and be my forever gaming buddy. But beware I'm a day walking vamp 🧛🏼#gt25 #igotin8w"
2021-04-12T18:17:09.000Z,Nora,"Scarsdale, NY.",NY,BLANK,BME or,nora.butler514,"Hii! I'm Nora and I'm from Scarsdale, NY. I'm about 95% committed to GT and plan to major in BME or ChemE. I run xc and track, and I like being outdoors, hanging with friends, reading, animals, trying new music (but I love anything pop!) food, and baking. I'd love to meet some people before going in the fall, maybe even find a roommate, so please reach out! ig: @nora.butler514 snap: no.butler#gt25 #igotin8w"
2021-04-12T16:45:27.000Z,Nate Boyd,Northeast Georgia,GA,B,either Global,,"Hey! My name's Nate Boyd and I'm from Northeast Georgia. I'm not committed to tech yet, but it's definitely one of my top choices. I plan on majoring in either Global Econ and World Lang or Biology. I love listening to music and enjoying the outdoors. My insta is @nateboyd_#gt25 #igotin8w"
2021-04-12T12:15:50.000Z,Kayla,Barbados,,BLANK,computer science,kayla.gk,"Hi there :) my name is Kayla and I'm from Barbados (in the Caribbean)🌴. I've been admitted to ga tech for fall 2021 and I plan to major in computer science ! I do t&f and gymnastics and I like watching movies and reading. I'm excited to meet all of you and make friends, so feel free to reach out and say hi! 💗insta: @kayla.gksnap: Kaylz.bae#gt25 #igotin8w"
2021-04-12T09:54:10.000Z,Chris,december,,B,business administratio,chrisparker._,"What's up guys i'm Chris and I live just outside of Atlanta. I was admitted back in december but just committed. I plan on majoring in business administration (might change might not who knows😎). I'll be starting this summer in the Challenge program so I'm looking forward to meeting some of you!Some things I like are track, working out, and almost any kind of music. SOME country is ok but heavy metal is only acceptable in the weight room🙅🏾‍♂️. Love watching anime (started One Piece last week wish me luck), hanging out with friends, and exploring the city! I'm looking for a roommate so feel free to reach out:ig: chrisparker._👻: cman4853#gt25 #igotin8w"
2021-04-12T04:33:14.000Z,Austin Buck,Buck,,BLANK,,almost,"Hey guys! My name is Austin Buck. I am currently a student at Sequoyah High School in Woodstock, GA. I'm 100% committed to Georgia Tech for electrical engineering, and will doing Fall Study Abroad my first semester in France, so if you're also going lmk! I'm a sailor, a pilot (kind of), a fisherman, and a bit of a Star Wars nerd, and am really looking forward to meeting and getting to know the rest of y'all on campus over the next few years!(Disclaimer: almost all of these pictures were taken pre-pandemic, so excuse the lack of masks)#gt25 #igotin8w"
2021-04-12T02:30:17.000Z,pratham,"mumbai, india",,BLANK,,i,"hello! im pratham from mumbai, india and im so excited to have gotten into tech for cs (actually computational media but i might switch idk lol) !! i love math (like i do math in my free time), biking, baking, filmmaking, card magic, and making bad puns. im super duper intrigued by the human brain and hope to pursue the intelligence and people threads. if u want to have a three-hour long debate about why we live in a deterministic society (and maybe a simulation) hmu lmaoo my instas are @twix.up.my.sleeve and @pats_2903 ps: i make a mean cookie & brownie combo#gt25 #igotin8w"
2021-04-12T00:55:20.000Z,amogha,"cumming,ga",GA,BLANK,computer science,,"hey everyone! my name is amogha and i'm from cumming,ga! i'm majoring in computer science next year and am so excited. i love to sing, dance, hang out with my friends, and binge so many tv shows! i'm looking forward to making new friends and am also looking for a potential roommate so feel free to reach out!!#gt25 #igotin8w"
2021-04-12T00:16:47.000Z,Zach Uhlig,Chicago,,B,computer science,z_batmint,"Hey everyone! I'm Zach Uhlig and I'm from Chicago. I'm committed to Tech and I plan to major in computer science and minor in Econ. I play volleyball, workout a lot, and like to go out so I'll definitely be rushing in the Fall. I'm looking for a roommate so feel free to reach out. Sc: z_batmint (made it a while ago) Ig: @zachuhlig#gt25 #igotin8w"
2021-04-11T23:46:42.000Z,Max,the Bay Area,,BLANK,on my,,Hey everyone! My name is Max and I am from the Bay Area. I have not yet committed to Georgia Tech but is definitely one of my top choices. I really enjoyed playing basketball and I am planning to walk on to the team. I have also really gotten into working out lately. I am still undeclared on my major but looking forward to meeting new people! Insta:@hoopslifting8w
2021-04-11T21:39:36.000Z,Maya,"Duluth, Georgia",GA,BLANK,biomedical engineering,mayasultan704,"Hey everyone, I'm Maya! I'm from Duluth, Georgia and I recently committed to tech. I am majoring in biomedical engineering and I plan on rushing. I like hanging out with friends, watching netflix (love gossip girl and the vampire diaries!!), and shopping. I am also looking for a roommate and would love to get to know y'all so feel free to dm me! insta: @mayasultan704snap: maya_sultan#gt25 #igotin8w"
2021-04-11T14:49:49.000Z,dani,sandy springs,,B,public policy,moes,"hey guys! i'm dani and i'm from sandy springs, georgia. i plan to major in public policy and i'll probably rush. i've played softball and swam my whole life and i love football/sports in general, working out, being outside, watching movies, and listening to music. some favorite things: moes, the beach, taylor swift, love island uk, new girl, sza, one direction, zootopia, high school musical😁 i haven't committed but probably will soon and am looking for a roommate so please reach out! go jackets!#gt25 #igotin.8w"
2021-04-11T01:36:00.000Z,clarissa,the usa mostly,,BLANK,excited to,clarissaykmm,"hi! i'm clarissa! i grew up in the usa mostly but i've lived in tokyo, japan since the beginning of high school. i'm 100% committed to tech and excited to major in industrial design! i like art (especially anything with vibrant colors!), am obsessed with early 2010s pop music (especially lady gaga), and vibe with kpop/k-indie/khh/krnb a lot (my favorites are shinee, bts, epik high, suggi, dpr live, and lee hi). I like doing anything with friends (long walks with no concrete destination, picnics, and thrifting are a lot of fun). i'm excited to meet everyone and feel free to reach out! instagram: @clarissaykmm#gt25 #igotin8w"
2021-04-11T00:31:56.000Z,Wonho Lim,South Korea,,BLANK,computer science,wonholim02,"Hi everyone! My name is Wonho Lim and I'm from South Korea. I'm not committed to GT yet but it's definitely my top choice. I'm planning to major in computer science or computational media. I love to enjoy sports(especially baseball and soccer), hang out with friends, and travel. I hope to make many friends before I go to school and I'm looking for a potential roommate, so please feel free to follow me and DM me. I can't wait to meet you all at the school and congrats on getting accepted!instagram: @wonholim02#gt25 #igotin8w"
2021-04-10T22:57:14.000Z,Matthew Blawat,"Fayetteville, GA.",GA,B,,,"Hi my name is Matthew Blawat I am from Fayetteville, GA. I play football and baseball and enjoy hunting, golf and hanging with friends.  I am committed to Tech and have a roommate but am looking for more friends. Feel free to hmu for snap or to chat.#gt25 #igotin8w"
2021-04-10T20:48:13.000Z,collin kelly,northeast georgia,GA,BLANK,computer engineering,,"hey! my name is collin kelly and i am from northeast georgia. i am committed, and majoring in computer engineering. i run cross country and track (but i probably won't run much in college). i spend my time working at mcdonalds, hanging out with my friends, and watching anime. i plan on rooming with my best friend, and we are looking for potential roomates. if you want to get to know me, feel free to talk to me on instagram or snapchat @kelcollin#gt25 #igotin8w"
2021-04-10T18:48:06.000Z,Aziz Mahmud,,,BLANK,erospace engineering,,"Hey my names Aziz Mahmud. I will be joining Georgia Tech as a transfer student in 2022 as they offered admissions for the fall of 2022 school year but not 2021. However, I am still super grateful because Georgia tech is my dream school. I'm going to be an aerospace engineering major and I love to listed to music (ASAP Rocky, billy Joel, Rich Brian, Old 2000 pop) workout and play tennis. I'm down to meet whoever so message me on insta or add me on Snapchat Snap-Azmahmud#gt25 #igotin8w"
2021-04-10T17:54:07.000Z,Macy,Gwinnett County GA,GA,BLANK,Mechanical Engineering,,"Hi everyone!! My name is Macy and I'm from Gwinnett County GA. I am 100% committed to Tech and will me majoring in Mechanical Engineering. I played volleyball throughout HS and lately I love playing tennis! I might join the concert band at tech (I play clarinet) but I'm not sure. I love coffee, shopping, listening to music, and hanging out with friends. I can't wait to meet new people and I am looking for a roommate so feel free to reach out!! :)Ig and snap @macy.maynard#gt25 #igotin8w"
2021-04-10T16:16:57.000Z,Hayden,Hilton Head,,BLANK,I am,hayden_bird13,"Hi guys!! My name is Hayden, and I am from Hilton Head, South Carolina. I am committing to Georgia Tech and I am majoring in Aerospace Engineering! I love running, obviously writing second order knowledge questions for IB, singing to Nicki Minaj, and cooking. I am also lowkey a baller and will take anyone on the courts. My favorite show is Total Drama (and yes I agree that Leshawna and Courtney should win). Growing up on an island,  I love the outdoors but I literally have zero experience in the city so if I'm lost please laugh. I am totally down to make some awesome friends!! Now that all the professional stuff has been said, we should all start a cause to get ✨Sister Cindy✨ to preech on Georgia Tech's campus.See you guys there!!Insta: hayden_bird13Snap: hayden_bird13#gt25 #igotin8w"
2021-04-10T00:04:23.000Z,Tyler Hankin,"Atlanta, GA.",GA,BLANK,Industrial Engineering,,"Hi my name is Tyler Hankin and I'm from Atlanta, GA. I am 100% committed to GT with a major in Industrial Engineering, and I look forward to meeting you all! I love being outdoors, playing lacrosse, fishing, and spending time with friends. I plan on rushing next year and I am still working on finding a roommate, so feel free to DM me @tylerhankin or sc me @tylerhank2003#gt25 #igotin8w"
2021-04-10T00:01:58.000Z,Patrisiya Rumyantseva,"Marietta, Georgia",GA,BLANK,biomedical engineering,,"Hey my name is Patrisiya Rumyantseva. I'm from Marietta, Georgia, but originally from St. Petersburg, Russia. I plan to major in biomedical engineering. I like to explore with my friends and go to the gym.#gt25 #igotin8w"
2021-04-09T21:02:50.000Z,Sasha,Myrtle Beach,,BLANK,chemistry,sashabrono,"Hello! I'm Sasha and I'm from Myrtle Beach, SC. I'm not committed to Tech yet, but it's my first choice. I'm planning on majoring in chemistry and minoring in computing & intelligence. I love iced chai lattes, taking naps at inappropriate times, high rise jeans, and the Weeknd (yes, that picture is real). I'm looking forward to meeting you all!! If you ever need a friend, I'm always available to talk. :) Instagram: sashabrono#gt25 #igotin8w"
2021-04-09T19:08:16.000Z,Lydia,the suburbs of Chicago,,BLANK,Computer Science,,"Hellooo my name is Lydia! I'm from the suburbs of Chicago and I'll be attending iGniTe as a Computer Science major. I'm superr into music- I listen to just about every genre (my tops right now being The Smiths, Pierre Bourne, Outkast, MGMT...) and I'm always looking for some new music recs! I also love art, clothes, shoes, thrifting, trying new foods, and I'm an avid art museum attender. I'm looking forward to meeting new people and making some friends!! Reach out to me on snap @lydia.bae :))#gt25 #igotin8w"
2021-04-09T16:26:21.000Z,Ayusha,"Kennesaw, GA",GA,BLANK,biomedical engineering,,"Hey!! My name is Ayusha and I'm super excited to go to tech this fall (and rush)! I'm from Kennesaw, GA and am majoring in biomedical engineering. I love going on hikes and runs, late night Taco Bell, lake trips, driving around, and listening to music,, especially country!! I've recently gotten back into reading but am always down for a night out or trip into the mountains! I'd love to get to know y'all and am looking for a roommate so pls feel free to reach out! My snap and insta are @ayusha.prasad#gt25 #igotin8w"
2021-04-09T03:54:16.000Z,Jason Jagielo,"Kildeer, Illinois",,B,,ja.gielo,"Hey everyone. My name is Jason Jagielo and I am from Kildeer, Illinois (Just outside of Chicago). I am committed to Tech and will be studying Computer Engineering. I love working out, playing sports, and eating in my free time! I'm planning to rush this fall and am also looking for roommate so hmu if interested! Super excited to meet everyone!Insta: @ja.gielo Snap: @jdawg0079#gt25 #igotin8w"
2021-04-09T02:21:31.000Z,Michelle Moise,Hollywood Florida,,BLANK,Computer Science,,"Hey everyone! My name is Michelle Moise. I am actually am from Hollywood Florida but I grew up in Douglasville, GA. I am not fully committed to Tech, but I will most likely commit. I plan on majoring in Computer Science and hopefully minoring in Digital Media Production. Some little fun facts about me is that I am obssessed with 90s/2000s cartoons, I make YouTube videos and I enjoy listening to rap music. I'm so excited to get to meet you all!! Feel free to hit me up and add me on Instagram @michvibesss💙#gt25 #igotin8w"
2021-04-09T01:55:30.000Z,kayla,southern virginia,,BLANK,chemical,,"hey y'all! i'm kayla from southern virginia, and i'll be majoring in chemical and biomolecular engineering. gt is my top school, so i'm p sure i'll be going there in the fall. i've danced my whole life, and plan on trying out for gt's dance team. i also LOVE grain bowls, the lumineers, and national parks (esp zion and yosemite). i'm looking for new friends and a roommate! 5w6 and intj if those mean anything to u :) SO excited to explore atl!!all socials are @kaylafischerr#gt25 #igotin8w"
2021-04-09T01:11:19.000Z,Dara Burkholder,"Denver, Colorado",,BLANK,math,darabb10,"Hey guys!! I'm Dara Burkholder from Denver, Colorado! I am committed to GT as a math major and I am considering minoring in comp sci. I love hiking, skiing, golfing, running, movies, and going out with my friends. I plan on rushing and I am looking for a roommate and new friends, so hmu :)Insta: darabb10Snap: darabb02#gt25 #igotin8w"
2021-04-08T19:15:34.000Z,Annelise,Marietta rn.,RN,BLANK,,,"What's up! I'm Annelise and I'm 100% committed to tech for computational media next year! I live in Marietta rn. I'm a huge fan of hiking, art, and coffee. I also love traveling and spending time with friends!I'm not sure if I'm going to rush yet, but I'm planning on joining the club swim team at tech! @allison.kurtz and I are looking for two more roommates for a quad, so let us know if you're interested!#gt25 #igotin9w"
2021-04-08T17:17:34.000Z,Drew Reich,"Albany, Georgia",GA,B,mechanical engineering,,"Hey everyone my name is Drew Reich and I'm from Albany, Georgia. I plan to major in mechanical engineering starting in the fall. I enjoy watching and playing most all sports and I plan to rush and play club or intramural sports while at Georgia Tech. I'm looking for a roommate so feel free to reach out at any time. I've been a fan of GT my whole life so I'm excited to get started.#gt25 #igotin9w"
2021-04-08T00:51:59.000Z,Suhana,"Roswell, GA",GA,BLANK,Business Administratio,suhana.shirol,"Hey I'm Suhana! I'm from Roswell, GA and I will be committing to Tech soon. I'm planning on majoring in Business Administration, but I've been considering a switch to Industrial Engineering. I also plan on minoring in Computing & Intelligence. I enjoy reading sociology books and I am reading something on NPR every other day. I enjoy going out with friends, staying active whenever I can, baking, watching Formula 1 races and documentaries (nature and science are my fav), and listening to new music. I've been loving Glass Animals and UMI recently. I'm so excited to explore the city, meet new people, and I look forward to having a great experience at Tech. I'd love to make some friends so feel free to reach out!ig: suhana.shirolsc: sshirol20#gt25 #igotin9w"
2021-04-07T22:24:07.000Z,Sebastian Calzolano,"Harrison, NY.",NY,BLANK,Mechanical Engineering,,"My name is Sebastian Calzolano and I'm from Harrison, NY. I'm committed to gatech and I'm planning to major in Mechanical Engineering. I'm a maker, and I love to ski, adventure, and play video games. I'm excited to meet some new friends, and possibly a roommate. Feel free to reach out, and congrats on everyone's acceptance!#gt25 #igotin9w"
2021-04-07T19:44:24.000Z,Tirth,"Cuthbert, GA",GA,BLANK,electrical engineering,,"Yooo, I'm Tirth and I'm from Cuthbert, GA a small town in the middle of nowhere🤠. I already committed and will be majoring in electrical engineering with a minor in CS or econ. I like to work out, read (currently rereading Percy Jackson), hike, kayak, explore new places, and just hang out with friends. I'm learning how to cook rn ( I can make some bomb pasta🤧) but I'm a huge foodie. I binge watch pretty much any tv show but I'm a big Star Wars/Harry Potter/ Marvel fan. My DM's open so hmu if your looking for a roommate on east campus or potentially a business partner?Insta @tirth.patel55 Snap @tirthpatel_2021#gt25 #igotin9w"
2021-04-07T18:16:47.000Z,Aadya,Dubai,,BLANK,computer engineering,aad.yaaaa,"Hi! My name is Aadya and I'm from Dubai. I am committed to Tech and plan on majoring in computer engineering. I enjoy dance, theatre, swimming, squash and basketball, and I am super excited to explore new things and meet new people in college. I'm also looking for a roommate and would love to make some friends here, so please reach out! Insta & snap: @aad.yaaaa#gt25 #igotin9w"
2021-04-07T11:52:27.000Z,Apoorva Mahendranath,"Greenville, South Carolina",,BLANK,industrial engineering,,"hey everyone! my name is Apoorva Mahendranath, and I am from Greenville, South Carolina. I plan on majoring in industrial engineering and attending the iGniTe program this summer! in my free time I love bharathanatyam and bollywood dancing, playing tennis with my friends, drawing, listening to new music, and watching tv/movies (taylor swift, harry styles, anything marvel, and criminal minds are some of my favs!) i'm looking to make new friends and a find roommate so pls reach out! i'd love to chat!!insta @apoorva.mahendranath#gt25 #igotin9w"
